1,nonummy maecenas tincidunt lacus at velit vivamus vel,http://accuweather.com,http://placekitten.com/220/220,2014-06-26 05:57:06,50
2,ipsum primis in,http://yandex.ru,http://placekitten.com/220/220,2014-10-05 16:20:52,34
3,in faucibus orci luctus et ultrices,https://usda.gov,http://placekitten.com/220/220,2014-07-24 15:24:53,43
4,ut tellus nulla ut erat id mauris vulputate,https://java.com,http://placekitten.com/220/220,2014-12-07 13:44:59,31
5,non pretium quis lectus suspendisse potenti in,http://ow.ly,http://placekitten.com/220/220,2014-10-09 10:53:21,45
6,elit proin interdum mauris non ligula pellentesque ultrices phasellus id,https://census.gov,http://placekitten.com/220/220,2015-03-05 12:38:19,25
7,tellus nisi eu orci mauris,http://squidoo.com,http://placekitten.com/220/220,2015-04-16 15:33:46,10
8,risus dapibus augue vel accumsan tellus,http://fotki.com,http://placekitten.com/220/220,2014-07-30 17:26:05,9
9,nulla dapibus dolor vel est donec odio justo,https://state.gov,http://placekitten.com/220/220,2015-02-23 23:18:37,29
10,duis consequat dui nec nisi,http://about.com,http://placekitten.com/220/220,2014-10-24 05:00:56,49
11,aliquam sit amet diam in magna bibendum imperdiet,http://uol.com.br,http://placekitten.com/220/220,2015-02-19 13:05:00,3
12,ut odio cras mi,http://umich.edu,http://placekitten.com/220/220,2014-07-13 04:01:22,44
13,sed tincidunt eu felis fusce posuere felis sed,http://slashdot.org,http://placekitten.com/220/220,2015-04-25 12:28:26,41
14,enim leo rhoncus sed vestibulum sit amet cursus id,http://bbb.org,http://placekitten.com/220/220,2014-06-22 23:50:50,35
15,tortor duis mattis egestas metus aenean fermentum,http://msn.com,http://placekitten.com/220/220,2015-04-29 16:35:32,41
16,erat nulla tempus vivamus in felis eu sapien cursus,http://ovh.net,http://placekitten.com/220/220,2014-11-18 09:17:19,33
17,pede ullamcorper augue a suscipit nulla elit,https://barnesandnoble.com,http://placekitten.com/220/220,2014-12-02 11:04:04,48
18,in congue etiam justo etiam pretium iaculis justo,https://behance.net,http://placekitten.com/220/220,2014-12-25 19:33:40,44
19,tempus sit amet sem fusce consequat,http://samsung.com,http://placekitten.com/220/220,2015-04-23 20:28:30,18
20,iaculis congue vivamus metus arcu adipiscing molestie hendrerit,http://java.com,http://placekitten.com/220/220,2014-10-06 12:05:43,13
21,nisi eu orci mauris lacinia sapien,http://sciencedaily.com,http://placekitten.com/220/220,2014-06-18 17:15:23,35
22,suscipit a feugiat et eros vestibulum ac,https://topsy.com,http://placekitten.com/220/220,2015-03-14 17:50:31,27
23,lacinia sapien quis libero,https://dailymotion.com,http://placekitten.com/220/220,2015-05-12 17:18:36,39
24,sodales sed tincidunt eu,http://spiegel.de,http://placekitten.com/220/220,2015-04-21 12:56:28,9
25,tellus nisi eu orci mauris lacinia,https://goo.gl,http://placekitten.com/220/220,2014-12-29 09:10:42,23
26,aenean lectus pellentesque eget nunc,http://buzzfeed.com,http://placekitten.com/220/220,2015-02-20 19:00:54,26
27,natoque penatibus et magnis dis parturient montes,https://parallels.com,http://placekitten.com/220/220,2014-11-01 16:56:36,10
28,venenatis non sodales sed tincidunt eu felis,http://newsvine.com,http://placekitten.com/220/220,2015-03-11 09:41:08,23
29,eu massa donec dapibus duis at velit eu est congue,https://parallels.com,http://placekitten.com/220/220,2015-03-04 09:10:44,49
30,ridiculus mus etiam vel augue vestibulum rutrum,http://tuttocitta.it,http://placekitten.com/220/220,2015-04-08 03:13:50,23
31,sit amet justo morbi ut odio,http://themeforest.net,http://placekitten.com/220/220,2015-02-26 21:01:38,35
32,platea dictumst maecenas ut massa quis augue luctus,https://e-recht24.de,http://placekitten.com/220/220,2014-06-24 09:49:39,32
33,metus sapien ut nunc vestibulum ante ipsum primis in faucibus,https://toplist.cz,http://placekitten.com/220/220,2014-06-17 13:31:54,32
34,bibendum felis sed interdum venenatis turpis enim,https://wikispaces.com,http://placekitten.com/220/220,2014-10-05 14:15:44,15
35,diam erat fermentum justo nec condimentum neque,http://vimeo.com,http://placekitten.com/220/220,2014-06-26 15:42:55,36
36,in faucibus orci luctus et ultrices posuere cubilia,https://joomla.org,http://placekitten.com/220/220,2014-11-04 17:49:26,42
37,augue luctus tincidunt nulla mollis molestie lorem,http://addtoany.com,http://placekitten.com/220/220,2015-05-11 07:41:35,17
38,integer a nibh,http://epa.gov,http://placekitten.com/220/220,2015-03-12 14:11:12,41
39,pede posuere nonummy integer non,http://domainmarket.com,http://placekitten.com/220/220,2014-11-17 16:56:20,28
40,vulputate justo in blandit ultrices enim lorem ipsum dolor,http://princeton.edu,http://placekitten.com/220/220,2014-12-11 09:40:13,4
41,proin risus praesent lectus vestibulum,http://wufoo.com,http://placekitten.com/220/220,2015-02-19 21:41:05,28
42,aliquam sit amet diam,https://ed.gov,http://placekitten.com/220/220,2014-10-31 01:34:45,49
43,nibh ligula nec sem,https://cmu.edu,http://placekitten.com/220/220,2014-09-07 04:34:32,14
44,sit amet sem,https://redcross.org,http://placekitten.com/220/220,2015-01-18 15:43:33,11
45,ultrices enim lorem ipsum dolor,https://epa.gov,http://placekitten.com/220/220,2014-12-31 06:19:33,12
46,lectus aliquam sit,http://slate.com,http://placekitten.com/220/220,2014-06-26 12:54:41,20
47,adipiscing elit proin risus praesent lectus vestibulum quam sapien,https://deliciousdays.com,http://placekitten.com/220/220,2015-05-19 07:23:53,50
48,aliquam quis turpis eget elit sodales scelerisque mauris sit amet,http://blogs.com,http://placekitten.com/220/220,2015-03-06 20:32:45,22
49,facilisi cras non velit nec nisi vulputate nonummy,http://artisteer.com,http://placekitten.com/220/220,2015-05-10 21:23:19,2
50,nulla elit ac nulla,https://netvibes.com,http://placekitten.com/220/220,2015-02-01 05:27:42,32
51,platea dictumst morbi,http://soup.io,http://placekitten.com/220/220,2014-06-15 12:58:50,39
52,orci nullam molestie nibh in,http://wordpress.com,http://placekitten.com/220/220,2015-04-12 17:36:43,44
53,vehicula condimentum curabitur,http://go.com,http://placekitten.com/220/220,2014-11-14 07:43:37,40
54,nulla nunc purus phasellus in felis donec semper sapien,http://nsw.gov.au,http://placekitten.com/220/220,2014-12-30 17:22:42,23
55,lacus at velit vivamus vel nulla,http://symantec.com,http://placekitten.com/220/220,2014-09-22 19:25:15,22
56,venenatis turpis enim blandit mi,http://wufoo.com,http://placekitten.com/220/220,2015-03-25 09:43:07,20
57,est phasellus sit,https://blogs.com,http://placekitten.com/220/220,2015-01-20 04:00:42,18
58,eget elit sodales,https://shutterfly.com,http://placekitten.com/220/220,2014-08-31 22:13:52,48
59,vel nulla eget eros elementum pellentesque quisque porta volutpat erat,https://eventbrite.com,http://placekitten.com/220/220,2014-06-28 02:08:15,9
60,quis orci eget,http://deviantart.com,http://placekitten.com/220/220,2015-04-02 09:22:16,12
61,lacinia erat vestibulum sed magna,http://uiuc.edu,http://placekitten.com/220/220,2014-09-03 03:43:17,32
62,eleifend luctus ultricies eu nibh quisque id justo sit,https://baidu.com,http://placekitten.com/220/220,2015-01-12 15:45:50,21
63,elit sodales scelerisque mauris sit,http://typepad.com,http://placekitten.com/220/220,2015-02-15 19:16:21,22
64,libero rutrum ac lobortis vel dapibus at diam nam tristique,https://reference.com,http://placekitten.com/220/220,2014-11-07 03:07:25,2
65,dui luctus rutrum nulla tellus in sagittis dui,http://t-online.de,http://placekitten.com/220/220,2014-06-22 13:04:29,14
66,lacinia aenean sit amet justo morbi,https://ocn.ne.jp,http://placekitten.com/220/220,2015-01-26 04:26:21,20
67,in eleifend quam a odio in hac,http://aboutads.info,http://placekitten.com/220/220,2014-11-16 10:48:49,48
68,risus dapibus augue vel,https://omniture.com,http://placekitten.com/220/220,2014-08-27 21:43:58,24
69,curabitur in libero ut,http://businessinsider.com,http://placekitten.com/220/220,2014-12-31 12:48:07,7
70,id luctus nec molestie sed justo,http://live.com,http://placekitten.com/220/220,2014-07-06 08:13:46,14
71,vestibulum aliquet ultrices erat tortor sollicitudin mi sit amet,http://wikipedia.org,http://placekitten.com/220/220,2014-12-16 02:47:32,28
72,rutrum nulla nunc purus phasellus in,http://ebay.co.uk,http://placekitten.com/220/220,2014-12-20 22:19:04,45
73,duis bibendum morbi non quam nec dui,http://hc360.com,http://placekitten.com/220/220,2014-11-12 13:34:28,35
74,justo pellentesque viverra pede ac diam cras pellentesque volutpat dui,http://google.ru,http://placekitten.com/220/220,2015-02-03 00:44:45,38
75,lacinia sapien quis libero nullam sit,https://naver.com,http://placekitten.com/220/220,2014-11-16 22:35:27,25
76,mattis nibh ligula nec sem duis aliquam,https://xinhuanet.com,http://placekitten.com/220/220,2014-11-27 20:31:15,6
77,interdum in ante vestibulum ante ipsum primis in faucibus,http://oakley.com,http://placekitten.com/220/220,2015-05-09 01:44:49,27
78,nec sem duis aliquam,https://t-online.de,http://placekitten.com/220/220,2014-09-09 07:51:11,34
79,quam turpis adipiscing lorem,https://opensource.org,http://placekitten.com/220/220,2015-04-14 22:57:29,24
80,et eros vestibulum ac est lacinia,https://trellian.com,http://placekitten.com/220/220,2015-03-15 05:27:26,48
81,duis faucibus accumsan odio curabitur convallis duis consequat,https://stumbleupon.com,http://placekitten.com/220/220,2015-03-18 00:10:36,13
82,scelerisque mauris sit amet eros suspendisse accumsan tortor quis,https://discovery.com,http://placekitten.com/220/220,2015-05-09 11:07:59,46
83,amet cursus id turpis integer aliquet,https://smh.com.au,http://placekitten.com/220/220,2014-08-25 13:51:17,4
84,natoque penatibus et magnis dis parturient montes nascetur ridiculus,http://canalblog.com,http://placekitten.com/220/220,2014-10-11 19:45:02,48
85,rutrum nulla nunc,http://4shared.com,http://placekitten.com/220/220,2014-09-11 18:48:07,21
86,eleifend pede libero quis orci nullam,https://edublogs.org,http://placekitten.com/220/220,2014-06-04 22:44:45,46
87,in libero ut massa volutpat convallis morbi odio odio,http://tuttocitta.it,http://placekitten.com/220/220,2014-07-11 09:01:59,47
88,sagittis dui vel nisl duis ac,http://printfriendly.com,http://placekitten.com/220/220,2014-07-29 10:42:47,26
89,justo in blandit ultrices enim,http://live.com,http://placekitten.com/220/220,2014-11-06 04:57:41,24
90,nonummy integer non velit donec diam neque,https://booking.com,http://placekitten.com/220/220,2014-07-25 11:04:34,42
91,viverra pede ac diam cras,https://t.co,http://placekitten.com/220/220,2014-10-17 16:04:10,18
92,semper interdum mauris ullamcorper purus,http://newyorker.com,http://placekitten.com/220/220,2014-07-21 22:49:18,30
93,fringilla rhoncus mauris enim leo rhoncus sed vestibulum sit,http://over-blog.com,http://placekitten.com/220/220,2014-12-20 06:10:10,49
94,nibh ligula nec sem duis,http://msn.com,http://placekitten.com/220/220,2015-03-10 11:42:09,33
95,sed augue aliquam erat volutpat in congue etiam,https://miitbeian.gov.cn,http://placekitten.com/220/220,2014-08-01 18:11:22,37
96,amet turpis elementum ligula vehicula consequat,http://usnews.com,http://placekitten.com/220/220,2014-11-07 05:42:07,31
97,id luctus nec molestie sed justo pellentesque,http://cmu.edu,http://placekitten.com/220/220,2015-04-24 11:31:51,32
98,in blandit ultrices enim lorem ipsum dolor sit amet,https://addthis.com,http://placekitten.com/220/220,2015-03-09 16:04:06,1
99,nulla tellus in sagittis dui vel nisl duis,http://yandex.ru,http://placekitten.com/220/220,2015-05-07 04:53:44,35
100,cras pellentesque volutpat dui maecenas tristique est et tempus semper,https://google.ru,http://placekitten.com/220/220,2015-02-16 16:01:32,29
